{
  "$schema": "http://json-schema.org/draft-07/schema#",
  "type": "object",
  "title": "FileUploadConfig",
  "description": "A file upload component with drag-and-drop, type validation, and size limits",
  "required": [
    "title"
  ],
  "properties": {
    "title": {
      "type": "string"
    },
    "acceptedTypes": {
      "type": "array",
      "items": {
        "type": "string"
      },
      "default": []
    },
    "maxFileSizeMB": {
      "type": "number",
      "default": 10,
      "minimum": 1
    },
    "maxFiles": {
      "type": "number",
      "default": 10,
      "minimum": 1
    },
    "uploadLabel": {
      "type": "string",
      "default": "Click to browse"
    },
    "dragDropLabel": {
      "type": "string",
      "default": "Drag and drop files here"
    },
    "appearance": {
      "type": "object",
      "description": "Visual polish: entrance animation, dark mode colors, responsive breakpoints",
      "properties": {
        "animation": {
          "type": "object",
          "properties": {
            "entrance": {
              "type": "string",
              "enum": [
                "none",
                "fade",
                "slide",
                "scale"
              ],
              "default": "none"
            },
            "duration": {
              "type": "number",
              "default": 300
            },
            "delay": {
              "type": "number",
              "default": 0
            }
          }
        },
        "darkMode": {
          "type": "object",
          "properties": {
            "background": {
              "type": "string"
            },
            "surface": {
              "type": "string"
            },
            "text": {
              "type": "string"
            },
            "textSecondary": {
              "type": "string"
            },
            "accent": {
              "type": "string"
            },
            "border": {
              "type": "string"
            }
          }
        },
        "responsive": {
          "type": "object",
          "properties": {
            "padding": {
              "type": "object",
              "properties": {
                "mobile": {
                  "type": "string"
                },
                "tablet": {
                  "type": "string"
                },
                "desktop": {
                  "type": "string"
                }
              }
            },
            "maxWidth": {
              "type": "object",
              "properties": {
                "mobile": {
                  "type": "string"
                },
                "tablet": {
                  "type": "string"
                },
                "desktop": {
                  "type": "string"
                }
              }
            },
            "fontSize": {
              "type": "object",
              "properties": {
                "mobile": {
                  "type": "number"
                },
                "tablet": {
                  "type": "number"
                },
                "desktop": {
                  "type": "number"
                }
              }
            }
          }
        }
      }
    }
  }
}
